{
  "$schema": "https://json-schema.org/draft/2020-12/schema",
  "title": "model-bindings.v1 \u2014 capability-tier \u2192 model/effort bindings for engine personas",
  "description": "Central persona model and effort bindings. Top-level tiers and overrides retain the existing Claude aliases. providers.codex declares provider-native persona models. Both providers keep reviewer effort unpinned; tier effort is used by audit and other execution personas. Dispatched workers retain the separate implementation_classes owner.",
  "type": "object",
  "additionalProperties": false,
  "required": [
    "schema_version",
    "tiers"
  ],
  "properties": {
    "schema_version": {
      "description": "Which version of this file's shape this is. Today the only valid value is 1.",
      "const": 1
    },
    "tiers": {
      "description": "The default binding for each capability tier. Both tiers are always present: judgment (careful reasoning) and mechanical (bounded work). A persona with no override inherits its tier's binding.",
      "type": "object",
      "additionalProperties": false,
      "required": [
        "judgment",
        "mechanical"
      ],
      "properties": {
        "judgment": {
          "$ref": "#/$defs/binding"
        },
        "mechanical": {
          "$ref": "#/$defs/binding"
        }
      }
    },
    "overrides": {
      "description": "Per-persona bindings, keyed by the persona's name (its .claude/agents/<name>.md slug). An override wins over the persona's tier default \u2014 this is how a specific lens is tuned to a stronger or cheaper model without changing its declared capability tier. A key that names no installed persona is a stale override, caught by the agent-bindings coherence test.",
      "type": "object",
      "additionalProperties": {
        "$ref": "#/$defs/override_binding"
      }
    },
    "implementation_classes": {
      "description": "Per-provider model/effort bindings for the DAG Build's DISPATCHED worker classes \u2014 the source of truth the coordinator renders into a worker's route and into the worker personas. This is a SEPARATE axis from the review `tiers`: reviewer personas resolve a name-free demand tier (judgment|mechanical) to one model, while a dispatched worker resolves its implementation class (builder|bounded) to a per-PROVIDER model+effort, because Claude and Codex realize the same class with different frontier/efficient models. The `integrator` class is never dispatched (it is the current senior session, so it carries no fixed binding here). A worker model alias MAY carry digits/dots (a provider-native family name like gpt-5.6-terra), so it uses its own grammar \u2014 the review `binding` anti-rot pattern is deliberately left untouched. Optional: a deployment with no DAG worker packs need not declare it.",
      "type": "object",
      "additionalProperties": false,
      "properties": {
        "builder": {
          "$ref": "#/$defs/implementation_binding"
        },
        "bounded": {
          "$ref": "#/$defs/implementation_binding"
        }
      }
    },
    "providers": {
      "description": "Provider-specific persona choices; Codex rendering refuses missing or invalid Codex bindings instead of inheriting a different model silently.",
      "type": "object",
      "additionalProperties": false,
      "properties": {
        "codex": {
          "$ref": "#/$defs/codex_personas"
        }
      }
    }
  },
  "$defs": {
    "override_binding": {
      "description": "One persona's override. The MODEL is required; the effort is OPTIONAL, and the three reviewer overrides deliberately omit it: a reviewer persona carries no effort frontmatter because effort is not part of the review contract, so an effort here would have nothing to ride on. An override without an effort keeps its tier's effort (workers).",
      "type": "object",
      "additionalProperties": false,
      "required": [
        "model"
      ],
      "properties": {
        "model": {
          "$ref": "#/$defs/binding/properties/model"
        },
        "effort": {
          "$ref": "#/$defs/binding/properties/effort"
        }
      }
    },
    "binding": {
      "description": "One model + effort pairing that realizes a capability demand.",
      "type": "object",
      "additionalProperties": false,
      "required": [
        "model",
        "effort"
      ],
      "properties": {
        "model": {
          "description": "A durable model alias \u2014 lowercase letters and hyphens only, NO digits, so a versioned id that rots (claude-opus-4-20250101) cannot be committed while any durable alias (opus, sonnet, haiku, fable) is accepted. The engine names no closed set of aliases.",
          "type": "string",
          "pattern": "^[a-z]+(-[a-z]+)*$"
        },
        "effort": {
          "description": "The reasoning-effort level that, with the model, realizes the tier. A bounded platform concept.",
          "enum": [
            "low",
            "medium",
            "high"
          ]
        }
      }
    },
    "implementation_binding": {
      "description": "One implementation class's bindings, one per provider. Both providers are present so a class renders explicitly for Claude and Codex from a single source, rather than one provider silently inheriting a frontier default.",
      "type": "object",
      "additionalProperties": false,
      "required": [
        "claude",
        "codex"
      ],
      "properties": {
        "claude": {
          "$ref": "#/$defs/provider_binding"
        },
        "codex": {
          "$ref": "#/$defs/provider_binding"
        }
      }
    },
    "provider_binding": {
      "description": "One provider-native model + effort pairing for a dispatched worker class. Unlike the review `binding`, the model alias MAY carry digits/dots so a provider-native family name (gpt-5.6-terra) is expressible; it remains an operator-tunable alias, not a dated snapshot id.",
      "type": "object",
      "additionalProperties": false,
      "required": [
        "model",
        "effort"
      ],
      "properties": {
        "model": {
          "description": "A provider-native model alias \u2014 lowercase alphanumerics separated by hyphen or dot (e.g. sonnet, haiku, gpt-5.6-terra). Digits are permitted here, unlike the review binding grammar.",
          "type": "string",
          "pattern": "^[a-z0-9]+([.-][a-z0-9]+)*$"
        },
        "effort": {
          "description": "The reasoning-effort level for this worker class.",
          "enum": [
            "low",
            "medium",
            "high"
          ]
        }
      }
    },
    "codex_personas": {
      "type": "object",
      "additionalProperties": false,
      "required": [
        "tiers"
      ],
      "properties": {
        "tiers": {
          "type": "object",
          "additionalProperties": false,
          "required": [
            "judgment",
            "mechanical"
          ],
          "properties": {
            "judgment": {
              "$ref": "#/$defs/provider_binding"
            },
            "mechanical": {
              "$ref": "#/$defs/provider_binding"
            }
          }
        },
        "overrides": {
          "type": "object",
          "additionalProperties": {
            "$ref": "#/$defs/native_override"
          }
        }
      }
    },
    "native_override": {
      "type": "object",
      "additionalProperties": false,
      "required": [
        "model"
      ],
      "properties": {
        "model": {
          "$ref": "#/$defs/provider_binding/properties/model"
        },
        "effort": {
          "$ref": "#/$defs/provider_binding/properties/effort"
        }
      }
    }
  }
}
